time, oge, time, 
year, afọ, age, afọ, 
people, ndị mmadụ, people, 
way, ụzọ, way, 
day, ụbọchị, day, 
man, nwoke, male, nwoke, 
thing, ihe, thing, 
woman, nwanyị, woman, 
life, ndụ, life, 
child, nwa, baby, nwa, 
world, ụwa, world, 
school, ụlọ akwụkwọ, school, 
state, ala, way, ụzọ, way, 
family, ezinụlọ, family, 
student, nwa akwukwo, student, 
group, otu, one, otu, 
country, mba, no, ee e, no., mba., no., 
problem, nsogbu, problem, 
hand, aka, but, ma, me, m, m, 
part, akụkụ, part, 
place, ebe, place, 
case, ikpe, judgment, ikpe, 
week, izu, weekly, kwa izu, weekly, 
company, ụlọ ọrụ, company, 
system, usoro, process, usoro, 
program, mmemme, program, 
question, ajụjụ, question, 
work, ọrụ, service, ọrụ, 
government, ọchịchị, government, 
number, nọmba, number, 
night, n'abalị, at night, n'abalị, 
mr, mr, 
point, isi, other, ọzọ, more, ọzọ, 
home, ulo, home, 
water, mmiri, water, 
room, ụlọ, house, ụlọ, 
mother, nne, mother, 
area, ebe, place, ebe, 
money, ego, money, 
story, akụkọ, story, 
fact, eziokwu, truth, eziokwu, 
month, ọnwa, month, 
lot, otutu, multiple, otutu, 
right, nri, food, nri, 
study, ọmụmụ, study, 
book, akwukwo, leaflet, akwukwo, 
eye, anya, look, anya, 
job, ọrụ, service, ọrụ, 
word, okwu, word, 
business, azụmahịa, business, 
issue, mbipụta, editions, mbipụta, 
side, n'akụkụ, side, 
kind, ụdị, type, ụdị, 
head, isi, other, ọzọ, more, ọzọ, 
house, ụlọ, house, 
service, ọrụ, service, 
friend, enyi, friend, 
father, nna, father, 
power, ike, power, 
hour, awa, awa, 
game, egwuregwu, game, 
line, akara, line, 
end, njedebe, end, 
member, otu, one, otu, 
law, iwu, law, 
car, ụgbọ ala, car, 
city, obodo, city, 
community, obodo, city, obodo, 
name, aha, name, 
president, onyeisi oche, chairman, onye isi oche, the chairman, onyeisi oche, 
team, otu, one, otu, 
minute, nkeji, minutes, nkeji, 
idea, echiche, thought, chere, wait, chere, 
kid, nwa, baby, nwa, 
body, ahụ, the body, ahụ, 
information, ozi, message, ozi, 
back, azụ, back, 
parent, nne na nna, parents, nne na nna, 
face, ihu, nose, imi, seek, chọọ, search, nyocha, research, nnyocha, research, 
others, ndị ọzọ, others, 
level, ọkwa, grade, ọkwa, 
office, ụlọ ọrụ, company, ụlọ ọrụ, 
door, ọnụ ụzọ, gate, ọnụ ụzọ, 
health, ahụ ike, health, 
person, onye, who, onye, 
art, nka, art, 
war, agha, war, 
history, akụkọ ihe mere eme, history, 
party, otu, one, otu, 
result, akpata, cause, akpata, 
change, gbanwee, change, 
morning, ụtụtụ, morning, 
reason, ihe kpatara ya, the reason, ihe kpatara ya, 
research, nnyocha, research, 
girl, nwa agbọghọ, girl, 
guy, ihọd, guy, 
food, nri, food, 
moment, oge, time, oge, 
air, ikuku, air, 
teacher, onye nkụzi, teacher, 
force, ike, power, ike, 
education, agụmakwụkwọ, education, 
foot, ụkwụ, foot, 
boy, nwa, baby, nwa, 
age, afọ, age, 
policy, iwu, law, iwu, 
process, usoro, process, 
music, egwu, music, 
market, ahịa, market, 
sense, uche, mind, uche, 
nation, mba, no, ee e, no., mba., no., 
plan, atụmatụ, plan, 
college, mahadum, university, mahadum, 
interest, mmasị, interest, 
death, ọnwụ, death, 
experience, ahụmahụ, experience, 
effect, mmetụta, effect, 
use, jiri, use, 
class, klas, class, 
control, njikwa, management, njikwa, 
care, lekọta, care, 
field, ubi, field, 
development, mmepe, development, 
role, ọrụ, service, ọrụ, 
effort, mgbalị, effort, 
rate, ọnụego, rate, 
heart, obi, heart, 
drug, ọgwụ, medication, ọgwụ, 
show, gosi, show, 
leader, onye ndu, leader, 
light, ìhè, light, 
voice, olu, voice, 
wife, nwunye, wife, 
police, ndị uwe ojii, police, 
mind, uche, mind, 
price, ego, money, ego, 
report, akụkọ, story, akụkọ, 
decision, mkpebi, decision, 
son, nwa, baby, nwa, 
view, lee, see, lee, 
relationship, mmekọrịta, relationship, 
town, obodo, city, obodo, 
road, ụzọ, way, ụzọ, 
arm, ogwe aka, arms, ogwe aka, 
difference, ọdịiche, difference, 
value, uru, value, 
building, ụlọ, house, ụlọ, 
action, edinam, action, 
model, nlereanya, model, 
season, oge, time, oge, 
society, ọha mmadụ, society, 
tax, ụtụ, tribute, ụtụ, 
director, onye nduzi, director, 
position, ọnọdụ, location, ebe, place, ebe, 
player, onye ọkpụkpọ, player, 
record, ndekọ, record, 
paper, akwụkwọ, book, akwukwo, leaflet, akwukwo, 
space, ohere, opportunity, ohere, 
ground, ala, way, ụzọ, way, 
form, ụdị, type, ụdị, 
event, ihe omume, event, 
official, onye ochichi, the governor, gọvanọ, governor, gọvanọ, 
matter, okwu, word, okwu, 
center, n'etiti, center, 
couple, di na nwunye, married, lụrụ, married, 
site, saịtị, sites, saịtị, 
project, oru ngo, project, 
activity, ọrụ, service, ọrụ, 
star, kpakpando, star, 
table, okpokoro, table, 
need, mkpa, need, 
court, ikpe, judgment, ikpe, 
american, american, 
oil, mmanụ, oil, 
situation, ọnọdụ, location, ebe, place, ebe, 
cost, ego, money, ego, 
industry, ụlọ ọrụ, company, ụlọ ọrụ, 
figure, ọnụ ọgụgụ, number, nọmba, number, 
street, n'okporo ámá, on the street, n'okporo ámá, 
image, oyiyi, image, 
phone, ekwentị, phone, 
data, data, 
picture, foto, photo, foto, 
practice, omume, practice, 
piece, otu, one, otu, 
land, ala, way, ụzọ, way, 
product, ngwaahịa, stock, ngwaahịa, 
doctor, dọkịta, doctor, 
wall, mgbidi, wall, 
patient, ndidi, patience, ndidi, 
worker, onye ọrụ, the user, onye ọrụ, 
news, akụkọ, story, akụkọ, 
test, ule, test, 
movie, ihe nkiri, the movie, ihe nkiri, 
north, n'ebe ugwu, north, 
love, ịhụnanya, love, 
support, nkwado, support, 
technology, nkà na ụzụ, technology, 
step, nzọụkwụ, step, 
baby, nwa, baby, 
computer, kọmputa, computer, 
type, ụdị, type, 
attention, anya, look, anya, 
film, ihe nkiri, the movie, ihe nkiri, 
republican, republican, 
tree, osisi, tree, 
source, isi iyi, source, 
organization, nzukọ, meeting, nzukọ, 
hair, ntutu, hair, 
look, anya, look, 
century, narị afọ, century, 
evidence, ihe akaebe, evidence, 
window, window, 
culture, omenala, culture, 
chance, ohere, opportunity, ohere, 
brother, nwanne, brother, 
energy, ike, power, ike, 
period, oge, time, oge, 
course, n'ezie, of course, n'ezie, 
summer, okpomọkụ, heat, okpomọkụ, 
plant, osisi, tree, osisi, 
opportunity, ohere, opportunity, 
term, okwu, word, okwu, 
letter, leta, letter, 
condition, ọnọdụ, location, ebe, place, ebe, 
choice, nhọrọ, option, nhọrọ, 
rule, ọchịchị, government, ọchịchị, 
daughter, nwa, baby, nwa, 
administration, nlekọta, care, lekọta, care, 
south, n'ebe ndịda, to the south, n'ebe ndịda, 
husband, di, di, 
congress, nzuko, meeting, nzukọ, meeting, 
floor, ala, way, ụzọ, way, 
campaign, mgbasa ozi, advertising, mgbasa ozi, 
material, ihe onwunwe, property, ihe onwunwe, 
population, ọnụ ọgụgụ mmadụ, population, 
call, oku, call, 
economy, akụ na ụba, economic, akụ na ụba, 
hospital, ụlọ ọgwụ, hospital, 
church, ụka, church, 
risk, ihe ize ndụ, risk, 
fire, ọkụ, fire, 
future, ọdịnihu, the future, ọdịnihu, 
defense, nchebe, safe, nchekwa, security, nche, security, 
security, nche, security, 
bank, ụlọ akụ, bank, 
west, n'ebe ọdịda anyanwụ, to the west, n'ebe ọdịda anyanwụ, 
sport, egwuregwu, game, egwuregwu, 
board, osisi, tree, osisi, 
subject, isiokwu, article, ederede, text, ederede, 
officer, onye nlekọta, overseer, onye nlekọta, 
rest, ezumike, vacation, ezumike, 
behavior, omume, practice, omume, 
performance, arụ ọrụ, work, ọrụ, service, ọrụ, 
top, n'elu, above, n'elu, 
goal, ihe mgbaru ọsọ, goals, ihe mgbaru ọsọ, 
second, nke abụọ, second, 
bed, akwa, great, akwa, 
order, iwu, law, iwu, 
author, onye edemede, writer, onye edemede, 
blood, ọbara, blood, 
agency, ụlọ ọrụ, company, ụlọ ọrụ, 
nature, ọdịdị, nature, 
color, agba, color, 
store, ụlọ ahịa, supermarket, ụlọ ahịa, 
sound, ụda, sound, 
movement, ije, walk, na-eje ije, to walk, na-eje ije, 
page, peeji nke, page, 
race, agbụrụ, ethnicity, agbụrụ, 
concern, nchegbu, anxiety, nchegbu, 
series, usoro, process, usoro, 
language, asụsụ, language, 
response, nzaghachi, response, 
animal, anụmanụ, animal, 
factor, ihe kpatara ya, the reason, ihe kpatara ya, 
decade, afọ iri, ten years old, afọ iri, 
article, ederede, text, ederede, 
east, n'ebe ọwụwa anyanwụ, to the east, n'ebe ọwụwa anyanwụ, 
artist, ese ihe, something else, ihe ọzọ, something else, 
scene, ihe nkiri, the movie, ihe nkiri, 
stock, ngwaahịa, stock, 
career, ọrụ, service, ọrụ, 
treatment, ọgwụgwọ, treatment, 
approach, bia, come, bia, 
size, size, 
dog, nkịta, dog, 
fund, ego, money, ego, 
media, mgbasa ozi, advertising, mgbasa ozi, 
sign, akara, line, akara, 
thought, chere, wait, chere, 
list, ndepụta, list, 
individual, onye ọ bụla, everyone, onye obula, anyone, onye ọ bụla, 
quality, mma, nice, mma, 
pressure, nrụgide, stress, nrụgide, 
answer, azịza, answer, 
resource, akụ, bankruptcy, ezighi ezi, wrong, ezighi ezi, 
meeting, nzukọ, meeting, 
disease, ọrịa, illness, ọrịa, 
success, ọganihu, progress, ọganihu, 
cup, iko, power, ike, power, 
amount, ego, money, ego, 
ability, ike, power, ike, 
staff, ndị ọrụ, workers, ndị ọrụ, 
character, agwa, character, 
growth, eto, program, mmemme, program, 
loss, ọnwụ, death, ọnwụ, 
degree, ogo, glory, ebube, glory, 
attack, agha, war, agha, 
region, mpaghara, region, 
television, telivishọn, television, 
box, igbe, box, 
tv, igwe onyonyo, tv set, igwe onyonyo, 
training, ọzụzụ, training, 
trade, ahia, trade, 
deal, eme, do, eme, 
election, ntuli aka, elections, ntuli aka, 
feeling, mmetụta, effect, mmetụta, 
standard, ọkọlọtọ, standard, 
bill, ụgwọ, debt, ụgwọ, 
message, ozi, message, 
analysis, nyocha, research, nnyocha, research, 
benefit, uru, value, uru, 
sex, mmekọahụ, sex, 
lawyer, ọkàiwu, lawyer, 
section, ngalaba, section, 
glass, iko, power, ike, power, 
skill, nkà, skill, 
sister, nwanne, brother, nwanne, 
professor, prọfesọ, professor, 
operation, arụ ọrụ, work, ọrụ, service, ọrụ, 
crime, mpụ, crime, 
stage, ogbo, stage, 
authority, ikike, rights, ikike, 
design, imewe, design, 
sort, ụdị, type, ụdị, 
one, otu, one, 
knowledge, ihe omuma, knowledge, 
gun, egbe, team, otu, one, otu, 
station, ụlọ ọrụ, company, ụlọ ọrụ, 
strategy, atụmatụ, plan, atụmatụ, 
truth, eziokwu, truth, 
song, abụ, sing, na-abụ abụ, sing, 
example, ihe atụ, for example, ọmụmaatụ, for example, 
environment, gburugburu ebe obibi, environment, 
leg, ụkwụ, foot, ụkwụ, 
public, ọha, public, 
executive, onyeisi, managing director, onye isi, managing director, 
set, setịpụ, set, 
rock, nkume, stone, nkume, 
note, dee, write, dee, 
manager, njikwa, management, njikwa, 
help, enyemaka, help, 
network, netwọk, network, 
science, sayensị, science, 
memory, ncheta, reminder, ncheta, 
card, kaadị, card, 
seat, oche, chairs, oche, 
cell, cell, 
trial, ikpe, judgment, ikpe, 
expert, ọkachamara, specialist, ọkachamara, 
spring, mmiri, water, mmiri, 
firm, guzosie ike, stand firm, guzosie ike, 
democrat, democrat, 
radio, redio, radio, 
management, njikwa, management, 
ball, bọọlụ, balls, bọọlụ, 
talk, okwu, word, okwu, 
theory, nkwupụta, statement, nkwupụta, 
impact, mmetụta, effect, mmetụta, 
statement, nkwupụta, statement, 
charge, ụgwọ, debt, ụgwọ, 
direction, nduzi, guidance, nduzi, 
weapon, agha, war, agha, 
employee, ọrụ, service, ọrụ, 
peace, udo, peace, 
base, isi, other, ọzọ, more, ọzọ, 
pain, mgbu, pain, 
play, egwu, music, egwu, 
measure, tụọ, point out, kwupụta, confess, kwupụta, 
interview, nyocha, research, nnyocha, research, 
chair, oche, chairs, oche, 
fish, azụ, back, azụ, 
camera, igwefoto, camera, 
structure, nhazi, configuration, nhazi, 
politics, ndọrọ ndọrọ ọchịchị, politics, 
bit, bit, 
weight, arọ, weight, 
candidate, nwa akwukwo, student, nwa akwukwo, 
production, mmepụta, production, 
trip, njem, travel, njem, 
evening, mgbede, evening, 
conference, ogbako, conference, 
unit, otu, one, otu, 
style, ụdị, type, ụdị, 
adult, okenye, elder, okenye, 
range, nso, close, nso, 
past, gara aga, past, 
edge, onu, on, na, na, 
writer, onye edemede, writer, 
trouble, nsogbu, problem, nsogbu, 
challenge, ihe ịma aka, challenge, 
fear, egwu, music, egwu, 
shoulder, ubu, shoulder, 
institution, ụlọ ọrụ, company, ụlọ ọrụ, 
sea, oké osimiri, sea, 
dream, nrọ, dream, 
bar, mmanya, alcohol, mmanya, 
property, ihe onwunwe, property, 
stuff, ihe, thing, ihe, 
detail, nkọwa, details, nkọwa, 
method, usoro, process, usoro, 
magazine, magazin, magazines, magazin, 
hotel, nkwari akụ, hotel, 
soldier, agha, war, agha, 
cause, akpata, cause, 
bag, akpa, first, akpa, 
heat, okpomọkụ, heat, 
fall, daa, yes, ee, yes, 
marriage, alụmdi na nwunye, marriage, 
surface, elu, up, elu, 
purpose, nzube, purpose, 
pattern, ụkpụrụ, standard, ọkọlọtọ, standard, 
skin, akpụkpọ, skin, 
agent, ụlọ ọrụ, company, ụlọ ọrụ, 
owner, nwe, owner, 
machine, igwe, machine, 
gas, gas, 
generation, ọgbọ, generation, 
cancer, cancer, 
item, ihe, thing, ihe, 
reality, eziokwu, truth, eziokwu, 
coach, nchịkwa, administrator, onye nlekọta, overseer, onye nlekọta, 
mrs, mrs, 
yard, agba, color, agba, 
violence, ime ihe ike, violence, 
investment, ego, money, ego, 
discussion, mkparịta ụka, conversation, mkparịta ụka, 
finger, mkpịsị aka, fingers, mkpịsị aka, 
garden, ubi, field, ubi, 
collection, nchịkọta, collection, 
task, ọrụ, service, ọrụ, 
partner, enyi, friend, enyi, 
kitchen, kichin, kitchen, 
consumer, onye ahịa, customer, onye ahịa, 
shot, gbara, shot, 
budget, mmefu ego, budget, 
painting, eserese, picture, foto, photo, foto, 
scientist, ọkà mmụta sayensị, scientist, 
agreement, nkwekọrịta, contract, nkwekọrịta, 
capital, isi obodo, the capital, isi obodo, 
mouth, ọnụ, mouth, 
victim, onye agha, the soldier, onye agha, 
newspaper, akwụkwọ akụkọ, newspapers, akwụkwọ akụkọ, 
threat, egwu, music, egwu, 
responsibility, ibu ọrụ, responsibility, 
attorney, onye ọka iwu, a solicitor, onye ọka iwu, 
score, akara, bread, achịcha, bread, 
account, akaụntụ, account, 
break, agbaji, break, 
audience, ndị na-ege ntị, the audience, ndị na-ege ntị, 
dinner, nri abalị, dinner, 
vote, ntuli aka, elections, ntuli aka, 
debate, arụmụka, debate, 
citizen, nwa amaala, citizen, 
majority, ọtụtụ, many, ọtụtụ, 
wind, ifufe, wind, 
mission, ozi, message, ozi, 
customer, onye ahịa, customer, 
speech, okwu, word, okwu, 
option, nhọrọ, option, 
participant, onye so na ya, a member, onye otu, member, otu, one, otu, 
forest, ọhịa, forest, 
video, video, 
senate, senate, 
reform, mgbanwe, change, gbanwee, change, 
access, ohere, opportunity, ohere, 
restaurant, ụlọ oriri na ọṅụṅụ, restaurants, ụlọ nri, restaurant, 
judge, ikpe, judgment, ikpe, 
relation, mmekọrịta, relationship, mmekọrịta, 
bird, nnunu, bird, 
opinion, echiche, thought, chere, wait, chere, 
credit, akwụ ụgwọ, paid, akwụ ụgwọ, 
corner, nkuku, corner, 
version, mbipute, version, 
safety, nchekwa, security, nche, security, 
neighborhood, agbata, neighbor, onye agbata obi, neighbor, 
act, eme, do, eme, 
troop , agha , battle , agha , 
income, ego, money, ego, 
species, ụdị, type, ụdị, 
track, egwu, music, egwu, 
hope, olileanya, hope, 
sky, elu igwe, up the sky, elu igwe, 
freedom, nnwere onwe, freedom, 
plane, ụgbọelu, plane, 
object, ihe, thing, ihe, 
attitude, àgwà, quality, mma, nice, mma, 
labor, arụ ọrụ, work, ọrụ, service, ọrụ, 
concept, echiche, thought, chere, wait, chere, 
client, onye ahịa, customer, onye ahịa, 
